{
  "schemaVersion": 1,
  "sourceRepository": "AquilaXk/easysubway",
  "snapshotLedger": "release/migrations/repository-split-issues.json",
  "amendments": [
    { "sourceIssue": 1685, "title": "[CI][Hub][P0] required-context drift 복구·always-run Hub CI Gate", "disposition": "KEEP_HUB", "targetRepository": "AquilaXk/easysubway", "targetUrl": null, "transferredAt": null, "reason": "Hub required CI context 정책 조정", "classifiedAt": "2026-08-09T00:24:32Z" },
    { "sourceIssue": 2649, "title": "[Feat][Data][P0] network_edges current admission consumer 결속", "disposition": "KEEP_HUB", "targetRepository": "AquilaXk/easysubway", "targetUrl": null, "transferredAt": null, "reason": "Hub current admission consumer coordination", "classifiedAt": "2026-08-09T00:24:32Z" },
    { "sourceIssue": 2700, "title": "[Architecture][Mobile] datapack lock과 verified AAB staging 도입", "disposition": "TRANSFER", "targetRepository": "AquilaXk/easysubway-mobile", "targetUrl": "https://github.com/AquilaXk/easysubway-mobile/issues/45", "transferredAt": "2026-08-01T16:08:48Z", "reason": "mobile datapack lock과 AAB staging 산출물 단독 소유", "classifiedAt": "2026-08-01T16:59:35Z" },
    { "sourceIssue": 2705, "title": "[Architecture][Data][P0] Task6 data 레포 생성·history extraction·issue transfer", "disposition": "KEEP_HUB", "targetRepository": "AquilaXk/easysubway", "targetUrl": null, "transferredAt": null, "reason": "5개 레포 분리 Task6 orchestration tracker의 hub 소유", "classifiedAt": "2026-08-01T16:59:35Z" },
    { "sourceIssue": 2710, "title": "[Feat] Aquila Software 공개 사이트와 EasySubway 제품 페이지 개편", "disposition": "KEEP_HUB", "targetRepository": "AquilaXk/easysubway", "targetUrl": null, "transferredAt": null, "reason": "공개 사이트 소유 레포 미정 — 오너 결정 대기 동안 hub 보류", "classifiedAt": "2026-08-01T16:59:35Z" },
    { "sourceIssue": 2712, "title": "[Architecture][Platform][P0] Task7 platform 레포 생성·digest-only deploy cutover", "disposition": "KEEP_HUB", "targetRepository": "AquilaXk/easysubway", "targetUrl": null, "transferredAt": null, "reason": "5개 레포 분리 Task7 orchestration tracker의 hub 소유", "classifiedAt": "2026-08-01T16:59:35Z" },
    { "sourceIssue": 2714, "title": "[Architecture][Backend][P0] Task8 backend 레포 생성·standalone image producer cutover", "disposition": "KEEP_HUB", "targetRepository": "AquilaXk/easysubway", "targetUrl": null, "transferredAt": null, "reason": "5개 레포 분리 Task8 orchestration tracker의 hub 소유", "classifiedAt": "2026-08-01T16:59:35Z" },
    { "sourceIssue": 2720, "title": "[Tooling][Migration][P0] transferred issue bare reference 정규화·검증", "disposition": "KEEP_HUB", "targetRepository": "AquilaXk/easysubway", "targetUrl": null, "transferredAt": null, "reason": "hub 소유 issue migration tooling", "classifiedAt": "2026-08-01T16:59:35Z" },
    { "sourceIssue": 2727, "title": "[CI][Architecture][P2] target Dependabot 완료·Hub /backend 중복 제거", "disposition": "KEEP_HUB", "targetRepository": "AquilaXk/easysubway", "targetUrl": null, "transferredAt": null, "reason": "4개 타깃 레포에 걸친 cross-repository 설정 조정", "classifiedAt": "2026-08-01T16:59:35Z" },
    { "sourceIssue": 2728, "title": "[Architecture][P0] Mobile source-file pin → Journey V3 mobile component manifest 전환", "disposition": "KEEP_HUB", "targetRepository": "AquilaXk/easysubway", "targetUrl": null, "transferredAt": null, "reason": "hub product gate 소유와 cross-repository 결합 해소", "classifiedAt": "2026-08-01T16:59:35Z" },
    { "sourceIssue": 2729, "title": "[Chore][Architecture] 동적 issue disposition ledger·SPLIT_CHILDREN·live drift audit", "disposition": "KEEP_HUB", "targetRepository": "AquilaXk/easysubway", "targetUrl": null, "transferredAt": null, "reason": "Hub issue disposition ledger와 live audit coordination", "classifiedAt": "2026-08-09T00:24:32Z" },
    { "sourceIssue": 2731, "title": "[Architecture][P0] Task 10 — hub runtime contraction·5-repo system release 검증", "disposition": "KEEP_HUB", "targetRepository": "AquilaXk/easysubway", "targetUrl": null, "transferredAt": null, "reason": "Hub runtime contraction과 system release coordination", "classifiedAt": "2026-08-09T00:24:32Z" },
    { "sourceIssue": 2732, "title": "[Architecture][P0] Backend·Data·Platform source-file pin → component/artifact manifest 전환", "disposition": "KEEP_HUB", "targetRepository": "AquilaXk/easysubway", "targetUrl": null, "transferredAt": null, "reason": "Hub component manifest identity coordination", "classifiedAt": "2026-08-09T00:24:32Z" },
    { "sourceIssue": 2734, "title": "[Architecture][P0] platform contract bundle v2 OCI digest·backend 단독 producer 전환", "disposition": "KEEP_HUB", "targetRepository": "AquilaXk/easysubway", "targetUrl": null, "transferredAt": null, "reason": "Hub platform contract publication coordination", "classifiedAt": "2026-08-09T00:24:32Z" },
    { "sourceIssue": 2739, "title": "[P0][Operations] timetable·route-bundle freshness 상시 감지·non-serving maintenance deployment", "disposition": "KEEP_HUB", "targetRepository": "AquilaXk/easysubway", "targetUrl": null, "transferredAt": null, "reason": "Hub freshness operation policy coordination", "classifiedAt": "2026-08-09T00:24:32Z" },
    { "sourceIssue": 2740, "title": "[Chore][Docs] Journey V3 freshness 만료 영향·운영 조치 서술 정합", "disposition": "KEEP_HUB", "targetRepository": "AquilaXk/easysubway", "targetUrl": null, "transferredAt": null, "reason": "Hub freshness documentation policy coordination", "classifiedAt": "2026-08-09T00:24:32Z" },
    { "sourceIssue": 2741, "title": "[Fix][Gate][P0] release binding 불변식 단일화·component manifest 전환 선행", "disposition": "KEEP_HUB", "targetRepository": "AquilaXk/easysubway", "targetUrl": null, "transferredAt": null, "reason": "Hub release binding gate policy coordination", "classifiedAt": "2026-08-09T00:24:32Z" },
    { "sourceIssue": 2742, "title": "[Feat][Epic][Architecture][P0] Journey V3 서버 정본 전환·5개 레포 통합 계약", "disposition": "KEEP_HUB", "targetRepository": "AquilaXk/easysubway", "targetUrl": null, "transferredAt": null, "reason": "Hub Journey V3 system architecture coordination", "classifiedAt": "2026-08-09T00:24:32Z" },
    { "sourceIssue": 2743, "title": "[Architecture][P0][No-Fallback] 5개 레포 구현상 semantic fallback 영구 금지·재도입 방지", "disposition": "KEEP_HUB", "targetRepository": "AquilaXk/easysubway", "targetUrl": null, "transferredAt": null, "reason": "Hub no-fallback policy coordination", "classifiedAt": "2026-08-09T00:24:32Z" },
    { "sourceIssue": 2747, "title": "[Contract][Hub][P1] Mobile consumer contract bundle v1·resource inventory 발행", "disposition": "KEEP_HUB", "targetRepository": "AquilaXk/easysubway", "targetUrl": null, "transferredAt": null, "reason": "Hub mobile consumer contract coordination", "classifiedAt": "2026-08-09T00:24:32Z" },
    { "sourceIssue": 2748, "title": "[Docs][Epic][Architecture][Operations][P1] ADR·Runbook·Playbook 연합형 거버넌스 도입", "disposition": "KEEP_HUB", "targetRepository": "AquilaXk/easysubway", "targetUrl": null, "transferredAt": null, "reason": "Hub documentation governance coordination", "classifiedAt": "2026-08-09T00:24:32Z" },
    { "sourceIssue": 2764, "title": "[Security][Supply Chain][P1] 5-re포 production artifact SBOM·SLSA provenance·VEX system-release binding", "disposition": "KEEP_HUB", "targetRepository": "AquilaXk/easysubway", "targetUrl": null, "transferredAt": null, "reason": "Hub supply-chain evidence policy coordination", "classifiedAt": "2026-08-09T00:24:32Z" },
    { "sourceIssue": 2765, "title": "[Architecture][Contract][P1] Journey API·3-artifact N/N-1 호환·deprecation lifecycle", "disposition": "KEEP_HUB", "targetRepository": "AquilaXk/easysubway", "targetUrl": null, "transferredAt": null, "reason": "Hub compatibility policy coordination", "classifiedAt": "2026-08-09T00:24:32Z" },
    { "sourceIssue": 2766, "title": "[Accessibility][Research][P1] 이동약자 현장 여정 검증·claim reconciliation·정정 SLA", "disposition": "KEEP_HUB", "targetRepository": "AquilaXk/easysubway", "targetUrl": null, "transferredAt": null, "reason": "Hub accessibility claim governance coordination", "classifiedAt": "2026-08-09T00:24:32Z" },
    { "sourceIssue": 2767, "title": "[Security][BCP][P1] GitHub·Play·Firebase·DNS·registry·signing identity custody·recovery drill", "disposition": "KEEP_HUB", "targetRepository": "AquilaXk/easysubway", "targetUrl": null, "transferredAt": null, "reason": "Hub identity custody and recovery policy coordination", "classifiedAt": "2026-08-09T00:24:32Z" },
    { "sourceIssue": 2768, "title": "[Product][Privacy][P2] privacy-preserving outcome metrics·retention·claim feedback loop", "disposition": "KEEP_HUB", "targetRepository": "AquilaXk/easysubway", "targetUrl": null, "transferredAt": null, "reason": "Hub privacy outcome policy coordination", "classifiedAt": "2026-08-09T00:24:32Z" },
    { "sourceIssue": 2776, "title": "[Data][Contract][P0] production source scope와 Data eligibility 동기화", "disposition": "KEEP_HUB", "targetRepository": "AquilaXk/easysubway", "targetUrl": null, "transferredAt": null, "reason": "Hub production source scope consumer coordination", "classifiedAt": "2026-08-09T00:24:32Z" },
    { "sourceIssue": 2786, "title": "[Release][Contract][P1] D22.2 product-gate issue owner identity 정합", "disposition": "KEEP_HUB", "targetRepository": "AquilaXk/easysubway", "targetUrl": null, "transferredAt": null, "reason": "Hub product-gate issue owner identity coordination", "classifiedAt": "2026-08-09T01:26:04Z" },
    { "sourceIssue": 2811, "title": "[Security][PLAN-DOC][P1] D20 same-window five-owner public-sensitivity live closure", "disposition": "KEEP_HUB", "targetRepository": "AquilaXk/easysubway", "targetUrl": null, "transferredAt": null, "reason": "Hub public-sensitivity live evidence coordination", "classifiedAt": "2026-08-10T14:46:52Z" },
    { "sourceIssue": 2812, "title": "[Docs][PLAN-DOC][P1] D35 eight-owner terminal-locator live closure", "disposition": "KEEP_HUB", "targetRepository": "AquilaXk/easysubway", "targetUrl": null, "transferredAt": null, "reason": "Hub terminal-locator live evidence coordination", "classifiedAt": "2026-08-10T14:46:52Z" },